{
    "$schema": "http://json-schema.org/draft-07/schema#",
    "type": "object",
    "properties": {
      "data_folder_path": {
        "type": "string"
      },
      "pull_requests_urls": {
        "type": "array",
        "items": {
          "type": "string",
          "format": "uri"
        }
      },
      "cve_name": {
        "type": "string"
      },
      "repo": {
        "type": "string"
      },
      "warnings": {
        "type": "object",
        "properties": {
          "cve": {
            "type": "string"
          },
          "warnings": {
            "type": "array",
            "items": {
              "type": "object",
              "properties": {
                "type": {
                  "type": "string"
                },
                "file_name": {
                  "type": "string"
                },
                "message": {
                  "type": "string"
                }
              },
              "required": ["type", "file_name", "message"]
            }
          }
        },
        "required": ["cve", "warnings"]
      },
      "files_extension_stats": {
        "type": "object",
        "additionalProperties": {
          "type": "integer"
        }
      },
      "file_number": {
        "type": "integer"
      },
      "removed_files_number": {
        "type": "integer"
      },
      "added_files_number": {
        "type": "integer"
      },
      "nb_lines_affected": {
        "type": "integer"
      },
      "private_key_files": {
        "type": "array",
        "items": {
          "type": "string"
        }
      },
      "languages": {
        "type": "array",
        "items": {
          "type": "string"
        }
      }
    },
    "required": ["data_folder_path", "pull_requests_urls", "cve_name", "repo", "warnings", "files_extension_stats", "file_number", "removed_files_number", "added_files_number", "nb_lines_affected", "private_key_files", "languages"]
  }
  