{
    "data_folder_path": "data/CVE-2022-4741",
    "pull_requests_urls": [
        "https://github.com/sajari/docconv/pull/111"
    ],
    "cve_name": "CVE-2022-4741",
    "repo": "sajari/docconv",
    "warnings": {
        "cve": "CVE-2022-4741",
        "warnings": [
            {
                "type": "NOT_MODIFIED",
                "file_name": "limit.go",
                "message": "not a modified file (status: FileStatus.ADDED)\n"
            }
        ]
    },
    "files_extension_stats": {
        ".go": 5
    },
    "file_number": 5,
    "removed_files_number": 0,
    "added_files_number": 0,
    "nb_lines_affected": 13,
    "private_key_files": [],
    "languages": [
        "Go"
    ]
}