{
    "data_folder_path": "data/CVE-2016-3072",
    "pull_requests_urls": [
        "https://github.com/Katello/katello/pull/6051"
    ],
    "cve_name": "CVE-2016-3072",
    "repo": "Katello/katello",
    "warnings": {
        "cve": "CVE-2016-3072",
        "warnings": []
    },
    "files_extension_stats": {
        ".rb": 3
    },
    "file_number": 3,
    "removed_files_number": 0,
    "added_files_number": 0,
    "nb_lines_affected": 30,
    "private_key_files": [],
    "languages": [
        "Ruby"
    ]
}