{
    "data_folder_path": "data/CVE-2019-15536",
    "pull_requests_urls": [
        "https://github.com/YourAcclaim/block_acclaim/pull/18"
    ],
    "cve_name": "CVE-2019-15536",
    "repo": "YourAcclaim/block_acclaim",
    "warnings": {
        "cve": "CVE-2019-15536",
        "warnings": []
    },
    "files_extension_stats": {
        ".php": 2,
        ".xml": 1
    },
    "file_number": 3,
    "removed_files_number": 0,
    "added_files_number": 0,
    "nb_lines_affected": 13,
    "private_key_files": [],
    "languages": [
        "PHP"
    ]
}