{
    "data_folder_path": "data/CVE-2023-30261",
    "pull_requests_urls": [
        "https://github.com/snaptec/openWB/pull/2673"
    ],
    "cve_name": "CVE-2023-30261",
    "repo": "snaptec/openWB",
    "warnings": {
        "cve": "CVE-2023-30261",
        "warnings": []
    },
    "files_extension_stats": {
        ".php": 3,
        ".sh": 1,
        ".py": 2
    },
    "file_number": 6,
    "removed_files_number": 0,
    "added_files_number": 0,
    "nb_lines_affected": 471,
    "private_key_files": [],
    "languages": [
        "PHP",
        "Python"
    ]
}