{
    "data_folder_path": "data/CVE-2021-41104",
    "pull_requests_urls": [
        "https://github.com/esphome/esphome/pull/2409/commits/207cde1667d8c799a197b78ca8a5a14de8d5ca1e"
    ],
    "cve_name": "CVE-2021-41104",
    "repo": "esphome/esphome",
    "warnings": {
        "cve": "CVE-2021-41104",
        "warnings": []
    },
    "files_extension_stats": {
        ".h": 1
    },
    "file_number": 1,
    "removed_files_number": 0,
    "added_files_number": 0,
    "nb_lines_affected": 5,
    "private_key_files": [],
    "languages": [
        "C"
    ]
}