{
    "data_folder_path": "data/CVE-2023-39553",
    "pull_requests_urls": [
        "https://github.com/apache/airflow/pull/33074"
    ],
    "cve_name": "CVE-2023-39553",
    "repo": "apache/airflow",
    "warnings": {
        "cve": "CVE-2023-39553",
        "warnings": []
    },
    "files_extension_stats": {
        ".py": 2
    },
    "file_number": 2,
    "removed_files_number": 0,
    "added_files_number": 0,
    "nb_lines_affected": 23,
    "private_key_files": [],
    "languages": [
        "Python"
    ]
}