{
    "data_folder_path": "data/CVE-2020-36629",
    "pull_requests_urls": [
        "https://github.com/SimbCo/httpster/pull/36"
    ],
    "cve_name": "CVE-2020-36629",
    "repo": "SimbCo/httpster",
    "warnings": {
        "cve": "CVE-2020-36629",
        "warnings": []
    },
    "files_extension_stats": {
        ".coffee": 1
    },
    "file_number": 1,
    "removed_files_number": 0,
    "added_files_number": 0,
    "nb_lines_affected": 23,
    "private_key_files": [],
    "languages": []
}