{
    "data_folder_path": "data/CVE-2022-4942",
    "pull_requests_urls": [
        "https://github.com/mportuga/eslint-detailed-reporter/pull/46"
    ],
    "cve_name": "CVE-2022-4942",
    "repo": "mportuga/eslint-detailed-reporter",
    "warnings": {
        "cve": "CVE-2022-4942",
        "warnings": []
    },
    "files_extension_stats": {
        ".js": 1
    },
    "file_number": 1,
    "removed_files_number": 0,
    "added_files_number": 0,
    "nb_lines_affected": 15,
    "private_key_files": [],
    "languages": [
        "Javascript"
    ]
}