{
    "data_folder_path": "data/CVE-2022-48364",
    "pull_requests_urls": [
        "https://github.com/mastodon/mastodon/pull/18525"
    ],
    "cve_name": "CVE-2022-48364",
    "repo": "mastodon/mastodon",
    "warnings": {
        "cve": "CVE-2022-48364",
        "warnings": []
    },
    "files_extension_stats": {
        ".rb": 1
    },
    "file_number": 1,
    "removed_files_number": 0,
    "added_files_number": 0,
    "nb_lines_affected": 3,
    "private_key_files": [],
    "languages": [
        "Ruby"
    ]
}