{
    "data_folder_path": "data/CVE-2016-1902",
    "pull_requests_urls": [
        "https://github.com/symfony/symfony/pull/17359"
    ],
    "cve_name": "CVE-2016-1902",
    "repo": "symfony/symfony",
    "warnings": {
        "cve": "CVE-2016-1902",
        "warnings": [
            {
                "type": "NOT_MODIFIED",
                "file_name": "src/Symfony/Component/Security/Tests/Core/Util/SecureRandomTest.php",
                "message": "not a modified file (status: FileStatus.REMOVED)\n"
            }
        ]
    },
    "files_extension_stats": {
        ".json": 2,
        ".php": 2
    },
    "file_number": 4,
    "removed_files_number": 0,
    "added_files_number": 0,
    "nb_lines_affected": 297,
    "private_key_files": [],
    "languages": [
        "PHP"
    ]
}