{
    "data_folder_path": "data/CVE-2023-25160",
    "pull_requests_urls": [
        "https://github.com/nextcloud/mail/pull/7740"
    ],
    "cve_name": "CVE-2023-25160",
    "repo": "nextcloud/mail",
    "warnings": {
        "cve": "CVE-2023-25160",
        "warnings": []
    },
    "files_extension_stats": {
        ".php": 2
    },
    "file_number": 2,
    "removed_files_number": 0,
    "added_files_number": 0,
    "nb_lines_affected": 36,
    "private_key_files": [],
    "languages": [
        "PHP"
    ]
}