{
    "data_folder_path": "data/CVE-2023-5676",
    "pull_requests_urls": [
        "https://github.com/eclipse-openj9/openj9/pull/18085"
    ],
    "cve_name": "CVE-2023-5676",
    "repo": "eclipse-openj9/openj9",
    "warnings": {
        "cve": "CVE-2023-5676",
        "warnings": []
    },
    "files_extension_stats": {
        ".c": 1
    },
    "file_number": 1,
    "removed_files_number": 0,
    "added_files_number": 0,
    "nb_lines_affected": 17,
    "private_key_files": [],
    "languages": [
        "C"
    ]
}