{
    "data_folder_path": "data/CVE-2021-31274",
    "pull_requests_urls": [
        "https://github.com/librenms/librenms/pull/12739"
    ],
    "cve_name": "CVE-2021-31274",
    "repo": "librenms/librenms",
    "warnings": {
        "cve": "CVE-2021-31274",
        "warnings": []
    },
    "files_extension_stats": {
        ".php": 1
    },
    "file_number": 1,
    "removed_files_number": 0,
    "added_files_number": 0,
    "nb_lines_affected": 2,
    "private_key_files": [],
    "languages": [
        "PHP"
    ]
}