{
    "data_folder_path": "data/CVE-2022-24831",
    "pull_requests_urls": [
        "https://github.com/OpenClinica/OpenClinica/pull/3490/commits/b152cc63019230c9973965a98e4386ea5322c18f"
    ],
    "cve_name": "CVE-2022-24831",
    "repo": "OpenClinica/OpenClinica",
    "warnings": {
        "cve": "CVE-2022-24831",
        "warnings": []
    },
    "files_extension_stats": {
        ".java": 3
    },
    "file_number": 3,
    "removed_files_number": 0,
    "added_files_number": 0,
    "nb_lines_affected": 30,
    "private_key_files": [],
    "languages": [
        "Java"
    ]
}