{
    "data_folder_path": "data/CVE-2020-12140",
    "pull_requests_urls": [
        "https://github.com/contiki-ng/contiki-ng/pull/1662"
    ],
    "cve_name": "CVE-2020-12140",
    "repo": "contiki-ng/contiki-ng",
    "warnings": {
        "cve": "CVE-2020-12140",
        "warnings": []
    },
    "files_extension_stats": {
        ".c": 1
    },
    "file_number": 1,
    "removed_files_number": 0,
    "added_files_number": 0,
    "nb_lines_affected": 16,
    "private_key_files": [],
    "languages": [
        "C"
    ]
}