{
    "data_folder_path": "data/CVE-2019-11404",
    "pull_requests_urls": [
        "https://github.com/arrow-kt/ank/pull/36"
    ],
    "cve_name": "CVE-2019-11404",
    "repo": "arrow-kt/ank",
    "warnings": {
        "cve": "CVE-2019-11404",
        "warnings": []
    },
    "files_extension_stats": {
        ".gradle": 1
    },
    "file_number": 1,
    "removed_files_number": 0,
    "added_files_number": 0,
    "nb_lines_affected": 8,
    "private_key_files": [],
    "languages": []
}