{
    "data_folder_path": "data/CVE-2017-6441",
    "pull_requests_urls": [
        "https://github.com/php/php-src/pull/2396"
    ],
    "cve_name": "CVE-2017-6441",
    "repo": "php/php-src",
    "warnings": {
        "cve": "CVE-2017-6441",
        "warnings": [
            {
                "type": "NOT_MODIFIED",
                "file_name": "Zend/tests/declare_006.phpt",
                "message": "not a modified file (status: FileStatus.ADDED)\n"
            }
        ]
    },
    "files_extension_stats": {
        ".c": 1,
        ".phpt": 1
    },
    "file_number": 2,
    "removed_files_number": 0,
    "added_files_number": 0,
    "nb_lines_affected": 16,
    "private_key_files": [],
    "languages": [
        "C"
    ]
}