{
    "data_folder_path": "data/CVE-2021-4264",
    "pull_requests_urls": [
        "https://github.com/linkedin/dustjs/pull/805"
    ],
    "cve_name": "CVE-2021-4264",
    "repo": "linkedin/dustjs",
    "warnings": {
        "cve": "CVE-2021-4264",
        "warnings": [
            {
                "type": "NO_PATCH",
                "file_name": "dist/dust-full.js",
                "message": "File has no patch data.\n"
            }
        ]
    },
    "files_extension_stats": {
        ".yml": 1,
        ".json": 1,
        ".js": 5
    },
    "file_number": 8,
    "removed_files_number": 0,
    "added_files_number": 0,
    "nb_lines_affected": 194,
    "private_key_files": [],
    "languages": [
        "Javascript"
    ]
}