{
    "data_folder_path": "data/CVE-2023-3724",
    "pull_requests_urls": [
        "https://github.com/wolfSSL/wolfssl/pull/6412"
    ],
    "cve_name": "CVE-2023-3724",
    "repo": "wolfSSL/wolfssl",
    "warnings": {
        "cve": "CVE-2023-3724",
        "warnings": []
    },
    "files_extension_stats": {
        ".c": 2
    },
    "file_number": 2,
    "removed_files_number": 0,
    "added_files_number": 0,
    "nb_lines_affected": 13,
    "private_key_files": [],
    "languages": [
        "C"
    ]
}