{
    "data_folder_path": "data/CVE-2021-45385",
    "pull_requests_urls": [
        "https://github.com/rockcarry/ffjpeg/pull/48"
    ],
    "cve_name": "CVE-2021-45385",
    "repo": "rockcarry/ffjpeg",
    "warnings": {
        "cve": "CVE-2021-45385",
        "warnings": []
    },
    "files_extension_stats": {
        ".c": 1
    },
    "file_number": 1,
    "removed_files_number": 0,
    "added_files_number": 0,
    "nb_lines_affected": 5,
    "private_key_files": [],
    "languages": [
        "C"
    ]
}