{
    "data_folder_path": "data/CVE-2023-2307",
    "pull_requests_urls": [
        "https://github.com/BuilderIO/qwik/pull/3862/commits/09190b70027354baf7ad3d208df9c05a87f75f57"
    ],
    "cve_name": "CVE-2023-2307",
    "repo": "BuilderIO/qwik",
    "warnings": {
        "cve": "CVE-2023-2307",
        "warnings": [
            {
                "type": "NOT_MODIFIED",
                "file_name": "packages/qwik-city/middleware/node/http.unit.ts",
                "message": "not a modified file (status: FileStatus.ADDED)\n"
            }
        ]
    },
    "files_extension_stats": {
        ".ts": 2
    },
    "file_number": 2,
    "removed_files_number": 0,
    "added_files_number": 0,
    "nb_lines_affected": 49,
    "private_key_files": [],
    "languages": []
}