{
    "data_folder_path": "data/CVE-2023-34460",
    "pull_requests_urls": [
        "https://github.com/tauri-apps/tauri/pull/6969#discussion_r1232018347"
    ],
    "cve_name": "CVE-2023-34460",
    "repo": "tauri-apps/tauri",
    "warnings": {
        "cve": "CVE-2023-34460",
        "warnings": [
            {
                "type": "NOT_MODIFIED",
                "file_name": ".changes/config-require-literal_leading_dot.md",
                "message": "not a modified file (status: FileStatus.ADDED)\n"
            }
        ]
    },
    "files_extension_stats": {
        ".md": 1,
        ".json": 2,
        ".rs": 2
    },
    "file_number": 5,
    "removed_files_number": 0,
    "added_files_number": 0,
    "nb_lines_affected": 168,
    "private_key_files": [],
    "languages": [
        "Rust"
    ]
}