{
    "data_folder_path": "data/CVE-2021-23807",
    "pull_requests_urls": [
        "https://github.com/janl/node-jsonpointer/pull/51"
    ],
    "cve_name": "CVE-2021-23807",
    "repo": "janl/node-jsonpointer",
    "warnings": {
        "cve": "CVE-2021-23807",
        "warnings": []
    },
    "files_extension_stats": {
        ".js": 2
    },
    "file_number": 2,
    "removed_files_number": 0,
    "added_files_number": 0,
    "nb_lines_affected": 34,
    "private_key_files": [],
    "languages": [
        "Javascript"
    ]
}