{
    "data_folder_path": "data/CVE-2021-36157",
    "pull_requests_urls": [
        "https://github.com/cortexproject/cortex/pull/4375"
    ],
    "cve_name": "CVE-2021-36157",
    "repo": "cortexproject/cortex",
    "warnings": {
        "cve": "CVE-2021-36157",
        "warnings": []
    },
    "files_extension_stats": {
        ".md": 2,
        ".go": 2
    },
    "file_number": 5,
    "removed_files_number": 0,
    "added_files_number": 0,
    "nb_lines_affected": 80,
    "private_key_files": [],
    "languages": [
        "Go"
    ]
}